{
  "schemaVersion": 1,
  "gate": "R0",
  "status": "passed",
  "sourceRevision": "dcaa0bf0f40e71aef796f33f48ed68b0f48a99b7",
  "dependencyReceipts": [],
  "authorityReferences": [
    "ROADMAP.md Approved 1.0",
    "authority commit a1a1ff90850303cfa490cc8a464de2fb63afc7e1"
  ],
  "environmentIds": {
    "githubRepository": "brandyn-s/minerva",
    "githubVisibility": "private",
    "canonicalBranch": "main",
    "vercelScope": "thalient",
    "vercelTeamId": "team_CPMDIZRXjSVqupCatDjsDq4Q",
    "vercelProject": "minerva",
    "vercelProjectId": "prj_JqzTIJqpZZZomnXhqMVnEPSNNzFe",
    "deploymentCount": 0,
    "integrationCount": 0,
    "productionAlias": "none"
  },
  "configurationIds": [
    {
      "id": "7mG9esJU3FHHe7Hq",
      "key": "MINERVA_ADMISSION_NAMESPACE",
      "target": "development"
    },
    {
      "id": "NnRQsWAA80W2eIfT",
      "key": "MINERVA_PROVIDER_ROUTES_ENABLED",
      "target": "development"
    },
    {
      "id": "W20s28g9z0WwANS6",
      "key": "MINERVA_ADMISSION_NAMESPACE",
      "target": "preview"
    },
    {
      "id": "empQW9ckPZH4S2mP",
      "key": "MINERVA_PROVIDER_ROUTES_ENABLED",
      "target": "preview"
    },
    {
      "id": "NoFbYWkIHBQTKxE4",
      "key": "MINERVA_ADMISSION_NAMESPACE",
      "target": "production"
    },
    {
      "id": "6KU344BtnS3iKohE",
      "key": "MINERVA_PROVIDER_ROUTES_ENABLED",
      "target": "production"
    }
  ],
  "configuration": {
    "browserDatabaseNamespace": "minerva.workspace.prototype.v1",
    "admissionNamespaces": {
      "development": "minerva-development",
      "preview": "minerva-preview",
      "production": "minerva-production"
    },
    "providerRoutesEnabled": {
      "development": false,
      "preview": false,
      "production": false
    },
    "vercelFramework": "nextjs",
    "vercelNodeVersion": "24.x"
  },
  "toolVersions": {
    "git": "2.50.1",
    "githubCli": "2.98.0",
    "node": "24.20.0",
    "npm": "12.0.2",
    "next": "16.3.4",
    "react": "19.2.8",
    "reactDom": "19.2.8",
    "typescript": "5.9.3",
    "eslint": "10.10.0",
    "eslintConfigNext": "16.3.4",
    "eslintCompat": "2.1.1",
    "ajv": "8.20.0",
    "vercelCli": "59.11.7",
    "gitleaks": "8.30.1"
  },
  "commands": [
    {
      "command": "root commit and authority preservation checks",
      "result": "pass",
      "summary": "Root a1a1ff90850303cfa490cc8a464de2fb63afc7e1 contains exactly the six approved documents; all six remain unchanged."
    },
    {
      "command": "git diff --check",
      "result": "pass",
      "summary": "0 whitespace errors"
    },
    {
      "command": "npm registry supported-tool metadata readback",
      "result": "pass",
      "summary": "ESLint 10.10.0 supports Node 24; eslint-config-next 16.3.4 declares ESLint >=9; @eslint/compat 2.1.1 supports ESLint 10 and Node 24."
    },
    {
      "command": "npm run lint",
      "result": "pass",
      "summary": "0 errors and 0 warnings under Node 24.20.0"
    },
    {
      "command": "npm run typecheck",
      "result": "pass",
      "summary": "0 TypeScript diagnostics under Node 24.20.0"
    },
    {
      "command": "npm test",
      "result": "pass",
      "summary": "17 passed, 0 failed, including 14 negative controls"
    },
    {
      "command": "npm run build",
      "result": "pass",
      "summary": "Next.js 16.3.4 compiled and generated the static R0 root shell under Node 24.20.0"
    },
    {
      "command": "npm run secrets:scan",
      "result": "pass",
      "summary": "Tracked-ignored guard returned 0 paths; redacted Git-history, staged-index, and selected-current-content gitleaks scans found 0 leaks"
    },
    {
      "command": "fresh npm ci and npm run check at clean source revision dcaa0bf0f40e71aef796f33f48ed68b0f48a99b7 before any R0 receipt existed",
      "result": "pass",
      "summary": "A genuinely clean detached worktree had no evidence/gates path; lint, typecheck, 17 tests, build, all three secret scans, and receipt-free status passed under Node 24.20.0/npm 12.0.2; METRIC accepted_gates=0"
    },
    {
      "command": "npm run roadmap:status after restoring evidence/gates/R0.json",
      "result": "pass",
      "summary": "Schema, approved gate set, passed-state semantics, filename/gate, unique gate, source resolution, and source ancestry checks passed; METRIC accepted_gates=1"
    },
    {
      "command": "npm run check after restoring evidence/gates/R0.json",
      "result": "pass",
      "summary": "Post-receipt lint, typecheck, 17 tests, build, all three secret scans, and roadmap status passed; METRIC accepted_gates=1"
    },
    {
      "command": "local development HTTP smoke",
      "result": "pass",
      "summary": "HTTP 200 and 3 of 3 completion/plumbing-only/no-capability assertions passed after Vercel link and development env verification"
    },
    {
      "command": "GitHub repository and Git remote readback",
      "result": "pass",
      "summary": "brandyn-s/minerva is private on main and origin is the only remote"
    },
    {
      "command": "Vercel project and local link readback",
      "result": "pass",
      "summary": "thalient/minerva IDs match .vercel/project.json; framework nextjs, Node 24.x, and no Git link"
    },
    {
      "command": "Vercel Git link isolation repair and readback",
      "result": "pass",
      "summary": "A transient canonical brandyn-s/minerva Git link was disconnected before push; project-scoped API readback returned link null and 0 deployments"
    },
    {
      "command": "Vercel environment inventory and development pull",
      "result": "pass",
      "summary": "6 of 6 ID/key/target entries are distinct across development, preview, and production; the pulled development env contains both required names"
    },
    {
      "command": "Vercel deployment, alias, and integration-resource inventories",
      "result": "pass",
      "summary": "0 deployments, 0 aliases, and 0 integration resources"
    },
    {
      "command": "provider route source inspection",
      "result": "pass",
      "summary": "0 route files; provider routes remain absent and disabled"
    },
    {
      "command": "npm audit --omit=dev --json",
      "result": "pass",
      "summary": "0 production dependency advisories"
    },
    {
      "command": "npm audit --json",
      "result": "fail",
      "summary": "Non-blocking Vercel CLI development-tree observation: 28 total advisories (1 critical, 14 high, 12 moderate, 1 low)"
    },
    {
      "command": "GitHub Dependabot open-alert inventory",
      "result": "fail",
      "summary": "Non-blocking development-scope observation: 35 open alerts (1 critical, 15 high, 15 medium, 4 low); GitHub and npm group advisories differently, so this does not contradict npm's 28"
    }
  ],
  "observableOutcome": "The isolated Minerva repository has reproducible source-bound R0 evidence, three-layer secret scanning for history, staged index, and selected current contents, strict approved-gate receipt semantics, and only a completed infrastructure shell.",
  "demoResult": "A genuinely clean checkout of the exact receipt-free source revision has no evidence/gates directory yet passes the bounded Node 24 check with accepted_gates=0; adding this receipt changes only the administrative result to accepted_gates=1, and the linked local shell returns HTTP 200 with completed-groundwork and no-product-capability claims.",
  "smallestDecisiveEvidence": [
    "The immutable root commit contains exactly the six authority documents, which remain unchanged.",
    "A clean detached worktree of the receipt-free source has no evidence/gates directory, passes fresh npm ci and the complete bounded check, and reports METRIC accepted_gates=0.",
    "Seventeen automated tests include fourteen negative controls for receipt semantics, ignored/history/staged/current secret coverage, and a failing Git path producer.",
    "The native tracked-ignored guard and redacted Git-history, staged-index, and temporary-index selected-current-content scans pass without exposing ignored local values.",
    "This receipt resolves to the receipt-free source revision, validates after restoration, and produces METRIC accepted_gates=1.",
    "The linked local shell returns HTTP 200 with exact completed-groundwork, plumbing-only, and no-product-capability text.",
    "GitHub and Vercel readbacks match the isolated IDs with zero deployments, aliases, or integration resources."
  ],
  "evidenceLevel": "E0 infrastructure only",
  "firstMaterialFalsifier": "Any predecessor repository state, deployment metadata, persistent data, secret, alias, analytics, or unstated product contract is imported.",
  "falsifierOccurred": false,
  "failures": [
    "Initial spec review rejected the prior receipt vocabulary, incomplete receipt enforcement, custom secret allowlist, deprecated ESLint pin, and stale README opening.",
    "Re-review found that the Git-history-only scan missed modified tracked and new untracked unignored content, and that the prior receipt named a source commit containing an obsolete invalid receipt.",
    "Final spec re-review found that source d53461a591aaf4c00f6e8c5f208d3a3c466151a4 depended on an empty evidence/gates directory that Git does not preserve, so its clean checkout could not produce the claimed zero result.",
    "Code-quality review found no separate staged-index scan, a producer-failure-masking path-list pipeline, permissive gate/passed-state receipt semantics, and a stale in-progress runtime heading.",
    "Final live readback found the canonical brandyn-s/minerva GitHub repository linked to the Vercel project; it was not predecessor state, but push was held because the link could violate the zero-deployment boundary.",
    "The first ESLint 10.10.0 lint run failed in an eslint-config-next bundled legacy plugin rule until the supported compatibility adapter was applied.",